{
   "id" : "6893ab56188b816c788947f9a6a49ede1975a286",
   "place_id" : "qgYvCi0wMDAwMDBjODZlNTRhZDRkOjZiMTJhZTM3YjQ3OmE3OWRlZmQ4YjQ3NjY4M2I",
   "reference" : "CkQxAAAALMuYKGpkRXIHoxy7xdMxLezpjAtHPTQfNSfEyD-qSXpL_GJ5UdT5DyUkx_PKsk_FMjYCvNeAo_1jRE8BpNkCrhIQ0X0Q-oo7wObuft3QaXOc2RoU3Y8OfDYWl820UUBgmtoUd2I5jh4",
   "scope" : "APP",
   "status" : "OK"
}
